ID,Created,Name,Description,Playlist URL
56b37df7c9a348aa84cb69c3e25ea272,2025-04-30T04:21:34Z,Islands In The Sun,"Music made on any island (except Manhattan, Great Britain and Honshu, which are famously atonal)",https://open.spotify.com/playlist/7A88AkWI3l5r27xpiHsQ6L
f5a2d9d3097b4ace8607cf7852d96e5c,2025-04-30T04:21:34Z,Testament To Youth In Verse,Songs about salad days,https://open.spotify.com/playlist/4ZOX5VuTEIeLvbN1tbol3v
2e0a32162b164cdcb89047ca96fa2b36,2025-04-30T04:21:34Z,"Tromboners, Etc., Etc.",Low brass favorites,https://open.spotify.com/playlist/623wu7z2AslQFeXg0grDz0
225f8250ebd445b491b900e4dd697d9a,2025-04-30T04:21:35Z,Boudoir Hits Vol I,,https://open.spotify.com/playlist/3daD2JSPLLUWJKWxwx2n1q
c0fc1b1bbaeb41caaa3a16b54483e76b,2025-04-30T04:21:35Z,Down At The Freeplay Lounge,"No rules, just right",https://open.spotify.com/playlist/3eN6c8DkoSEinu42Lyl9aN
